Disease_Name_English,Disease_Name_Spanish,Diagnosis,Treatments,Tests,Medications_Drugs
Abdominal aortic aneurysm,aneurisma aórtico abdominal,Physical examination; review of medical and family history; abdominal ultrasound (most common); abdominal CT scan; abdominal MRI.,Frequent health checkups and imaging (medical monitoring or watchful waiting); Surgery (endovascular repair; open surgery),Abdominal ultrasound; Abdominal CT scan; Abdominal MRI; Chest X-ray,Information not found
Absence seizure,crisis de ausencia,"Diagnosis involves detailed description of seizures by the healthcare professional; physical exam; electroencephalography (EEG), which may be triggered by hyperventilation; brain scans (MRI) to rule out other conditions.  Changes in brainwave patterns during an EEG are key to diagnosis.",Antiseizure medication; Ketogenic diet; Modified Atkins diet; Glycemic index diet,Electroencephalography (EEG); Brain magnetic resonance imaging (MRI),Ethosuximide (Zarontin); Valproic acid; Lamotrigine (Lamictal)
Acanthosis nigricans,acantosis nigricans,Acanthosis nigricans is detected during a skin exam; a skin biopsy may be performed for microscopic examination; other tests may be needed to determine the underlying cause.,Skin creams; special soaps; medications; laser therapy; weight loss (if obesity is a cause); discontinuation of medications or supplements (if implicated); surgery to remove tumor (if cancerous tumor is the cause),Skin biopsy; Other tests to determine underlying cause (unspecified),Information not found
Achalasia,acalasia,Achalasia is diagnosed through a combination of clinical symptoms and diagnostic testing.  Diagnostic tests are used to confirm the diagnosis and differentiate achalasia from other conditions with similar symptoms.  Esophageal manometry is the most helpful test to determine the type of swallowing condition.,Pneumatic dilation; OnabotulinumtoxinA (Botox) injection; Heller myotomy; Peroral endoscopic myotomy (POEM); Fundoplication; Medication (nitroglycerin; nifedipine),Esophageal manometry; X-rays of the upper digestive system (barium swallow); Upper endoscopy; Functional luminal imaging probe (FLIP) technology,Nitroglycerin; Nifedipine; OnabotulinumtoxinA (Botox)
Achilles tendinitis,tendinitis de aquiles,"Physical exam to assess pain, tenderness, swelling, and foot/ankle movement; Imaging tests may be used to rule out other conditions and visualize the tendon.","Self-care (RICE); Pain medications; Nitroglycerin patch; Physical therapy (exercises, orthotic devices); Extracorporeal shock wave therapy (ESWT); Platelet-rich plasma (PRP) injections; Ultrasound-guided tenotomy; Ultrasound-guided tendon scraping; Surgery",X-rays; Ultrasound; MRI,Ibuprofen; Naproxen sodium; Prescription medications for inflammation and pain relief; Nitroglycerin patch
Achilles tendon rupture,ruptura del tendón de aquiles,"Physical exam assessing tenderness, swelling, and a palpable gap in the tendon;  evaluation of plantar flexion by squeezing the calf muscle; ultrasound or MRI scan if the extent of the rupture is unclear.","Nonsurgical treatment (rest, ice, over-the-counter pain relievers, immobilization with a walking boot or cast); Surgery (incision and stitching of the tendon, possibly reinforced with other tendons; minimally invasive options available) ; Physical therapy (including functional rehabilitation).",Physical examination; Ultrasound; MRI scan,Over-the-counter pain relievers
ACL injury,lesión del ligamento cruzado anterior,"Physical exam assessing knee swelling, tenderness, and range of motion; diagnosis often made based on physical exam alone, but further tests may be needed to rule out other causes and determine injury severity.","Rehabilitative therapy (including exercises, bracing, and crutches); Surgery (ACL reconstruction using a tendon graft)",X-rays; Magnetic resonance imaging (MRI); Ultrasound,Information not found
Acne,acné,"Diagnosis of acne is primarily clinical, based on the presence of comedones (blackheads and whiteheads), papules, pustules, nodules, and cysts.  Severity is assessed based on the number and type of lesions.",Topical medications; Oral medications; Light therapy; Chemical peel; Drainage and extraction; Steroid injection,Information not found,"tretinoin (Avita, Retin-A); adapalene (Differin); tazarotene (Tazorac, Avage); clindamycin with benzoyl peroxide (Benzaclin, Duac); erythromycin with benzoyl peroxide (Benzamycin); azelaic acid (Azelex, Finacea); salicylic acid; dapsone (Aczone); minocycline; doxycycline; erythromycin; azithromycin; Ortho Tri-Cyclen 21; Yaz; spironolactone (Aldactone); isotretinoin (Amnesteem, Claravis); benzoyl peroxide"
Acoustic neuroma,neuroma acústico,"A thorough physical exam, including an ear exam;  Symptoms assessment; Hearing test (audiometry); Magnetic resonance imaging (MRI) with contrast dye; CT scan (if MRI unavailable or contraindicated).  Early diagnosis is difficult due to slow symptom onset and overlap with other ear conditions.","Monitoring; Surgery; Stereotactic radiosurgery (Gamma Knife, CyberKnife); Fractionated stereotactic radiotherapy (SRT); Proton beam therapy; Supportive therapy (balance therapy, physical therapy, occupational therapy, hearing assistance, cochlear implants).",Hearing test (audiometry); Magnetic resonance imaging (MRI) with contrast dye; CT scan,Information not found
Acromegaly,Acromegalia,"Diagnosis involves reviewing health history and physical examination;  high IGF-1 level in blood test suggests high growth hormone, a clue for acromegaly; growth hormone suppression test measures growth hormone levels before and after glucose intake (low levels after glucose in non-acromegaly patients); imaging tests (MRI) pinpoint pituitary tumors; X-rays of hands and feet check for bone growth.",Surgery to remove pituitary tumor; Medication to lower hormone levels; Radiation to shrink tumor,IGF-1 measurement; Growth hormone suppression test; Magnetic resonance imaging (MRI); X-rays of hands and feet,"octreotide (Mycapssa, Sandostatin); lanreotide (Somatuline Depot); cabergoline; bromocriptine (Cycloset, Parlodel); pegvisomant (Somavert)"
Actinic keratosis,Queratosis actínica,Visual examination by a healthcare provider; Skin biopsy if there is doubt.,Observation (may disappear on its own); Medicated cream or gel; Freezing (cryotherapy); Scraping (curettage); Electrosurgery; Laser therapy; Photodynamic therapy,Skin biopsy,"fluorouracil (Carac, Efudex); imiquimod (Aldara, Zyclara); diclofenac"
Acute coronary syndrome,síndrome coronario agudo,"Acute coronary syndrome is usually diagnosed in a hospital using a combination of patient symptoms, medical history, and diagnostic tests such as electrocardiogram (ECG or EKG), blood tests to check for heart proteins, and potentially coronary angiogram, echocardiogram, myocardial perfusion imaging, or CT angiogram to assess blood flow and artery blockages.  The tests help classify the condition as a heart attack or unstable angina.",Medicine; Angioplasty and stenting; Coronary artery bypass grafting (CABG),Electrocardiogram (ECG or EKG); Blood tests; Coronary angiogram; Echocardiogram; Myocardial perfusion imaging; CT angiogram; Exercise stress test,"Nitroglycerin; Aspirin; Clopidogrel (Plavix); Prasugrel (Effient); Metoprolol (Lopressor, Toprol-XL); Nadolol; Lisinopril (Qbrelis, Zestril); Benazepril (Lotensin); Irbesartan (Avapro); Losartan (Cozaar); Atorvastatin (Lipitor, Atorvaliq); Simvastatin (Zocor, Flolipid); Ezetimibe (Zetia); Clot busters (Thrombolytics)"
Acute flaccid myelitis (AFM),Mielitis flácida aguda (AFM),"Diagnosis begins with a thorough medical history and physical exam focusing on weakness, poor muscle tone, and decreased reflexes.  Further investigation may include nervous system examination; MRI of the brain and spinal cord; lab tests on cerebrospinal fluid, respiratory fluid, blood, and stool; and nerve conduction studies.  Differential diagnosis from other neurological conditions like Guillain-Barre syndrome is crucial.",Physical therapy; Occupational therapy; Immunoglobulin treatment; Corticosteroids; Antiviral drugs; Plasma exchange; Nerve and muscle transfer surgeries (in some cases),"Nervous system examination; Magnetic resonance imaging (MRI); Lab tests (cerebrospinal fluid, respiratory fluid, blood, stool); Nerve conduction studies; Electromyography (EMG); Lumbar puncture (spinal tap)",Immunoglobulin; Corticosteroids; Antiviral drugs
Acute kidney injury,lesión renal aguda,Diagnosis of acute kidney injury involves assessing blood tests (showing elevated urea and creatinine levels); urine output measurements (over 24 hours); urine tests (urinalysis); imaging tests (ultrasound and CT scans); and potentially a kidney biopsy (tissue sample for lab testing).  The diagnosis relies on identifying these factors to determine the extent of kidney function impairment and underlying cause.,Treating the underlying cause; Intravenous (IV) fluids; Diuretics; Potassium binders (sodium zirconium cyclosilicate (Lokelma); patiromer (Veltassa)); Calcium infusions; Hemodialysis; Special diet,Blood tests; Urine output measures; Urine tests (urinalysis); Imaging tests (ultrasound; CT scan); Kidney biopsy,Sodium zirconium cyclosilicate (Lokelma); Patiromer (Veltassa)
Acute liver failure,insuficiencia hepática aguda,"Assessment of liver function through blood tests (including prothrombin time to assess clotting); imaging tests such as ultrasound, CT scan, and MRI to visualize the liver and identify potential causes like Budd-Chiari syndrome or tumors; liver biopsy to examine liver tissue and determine the cause of failure.","Treatment of underlying cause (e.g., reversing poisoning); Medications to manage complications (e.g., cerebral edema, infections, bleeding); Nutritional support; Liver transplant; Artificial hepatic assist devices (e.g., extracorporeal liver support system/high-volume plasma exchange); Hepatocyte transplantation; Auxiliary liver transplantation; Xenotransplantation (experimental).",Blood tests; Prothrombin time test; Ultrasound; Abdominal CT scan; Magnetic resonance imaging (MRI); Liver biopsy (including transjugular liver biopsy),Acetylcysteine; Medications to reduce cerebral edema; Medications to treat infections; Medications to reduce bleeding risk; Nutritional supplements.
Acute lymphocytic leukemia,leucemia linfocítica aguda,"Diagnosis of acute lymphocytic leukemia involves blood tests revealing abnormal white blood cell counts and the presence of blast cells; bone marrow aspiration and biopsy to identify leukemia cells, classify them by type (B or T lymphocytes), and analyze genetic changes; imaging tests (X-ray, CT scan, ultrasound) to assess cancer spread; and spinal fluid test (lumbar puncture) to check for central nervous system involvement.  The seriousness is determined by lymphocyte type (B or T cells), genetic changes, age, and lab test results.  There are no stages.",Induction therapy; Consolidation therapy; Maintenance therapy; Preventive treatment to the spinal cord; Chemotherapy; Targeted therapy; Radiation therapy; Bone marrow transplant (stem cell transplant); CAR-T cell therapy; Clinical trials,Blood tests; Bone marrow aspiration; Bone marrow biopsy; X-ray; Computerized tomography (CT) scan; Ultrasound scan; Lumbar puncture (spinal tap),Information not found
Acute myelogenous leukemia,leucemia mielógena aguda,"Diagnosis begins with an exam checking for bruising, bleeding, infection, and swollen lymph nodes.  Further diagnosis involves blood tests (complete blood count to assess blood cell counts and identify myeloblasts), bone marrow aspiration and biopsy (to examine bone marrow cells for DNA changes), and sometimes a lumbar puncture (if spread to the brain and spinal cord is suspected). Imaging tests (CT, MRI, PET) may be used to assess for spread to other parts of the body.  Genetic testing is used to determine the AML subtype.",Chemotherapy; Targeted therapy; Bone marrow transplant; Clinical trials,Complete blood count; Blood test for myeloblasts; Bone marrow aspiration; Bone marrow biopsy; Lumbar puncture; CT scan; MRI scan; PET scan; Genetic testing,Information not found
Acute sinusitis,Sinusitis aguda,"Physical exam including palpation for tenderness in the nose and face; inspection of the nasal passages; nasal endoscopy; CT scan (not usually for simple cases, but may help rule out other causes); nasal and sinus samples (rarely used, but may be necessary if condition worsens or doesn't improve with treatment).","Self-care; saline nasal spray; nasal corticosteroids; decongestants; allergy medications (for allergy-induced sinusitis); pain relievers; antibiotics (for severe, worsening, or persistent symptoms); immunotherapy (for allergy-related sinusitis); nasal lavage (neti pot or squeeze bottle).",Nasal endoscopy; CT scan; Nasal and sinus samples,fluticasone; budesonide; mometasone; beclomethasone; acetaminophen; ibuprofen; aspirin
Addison's disease,enfermedad de addison,"Diagnosis involves reviewing medical history and symptoms, followed by tests to check for Addison's disease or secondary adrenal insufficiency.  Diagnostic criteria aren't explicitly listed but are implied through the diagnostic tests described.",Corticosteroid medication replacement; Increased sodium intake in diet; Corticosteroid injections in case of emergency; Medical alert card and bracelet; Action plan; Regular follow-up with healthcare professional; Yearly checkups,"Blood test (measuring sodium, potassium, cortisol, ACTH, and Addison's disease-related antibodies); ACTH stimulation test; Insulin-induced hypoglycemia test; CT scan of the stomach area; MRI of the pituitary gland","Hydrocortisone (Cortef); Prednisone (Rayos, Prednisone Intensol); Methylprednisolone (Medrol); Fludrocortisone acetate"
Adenomyosis,Adenomyosis,"Adenomyosis diagnosis is challenging due to similar symptoms with other uterine conditions like fibroids, endometriosis, and endometrial polyps. Diagnosis often involves ruling out other conditions.  Suspicion arises from signs and symptoms, pelvic exam revealing an enlarged, tender uterus, ultrasound, and MRI.  While pelvic imaging can detect signs, confirmation typically requires examination of the uterus post-hysterectomy; endometrial biopsy may rule out other conditions but won't confirm adenomyosis.","Anti-inflammatory drugs; Hormone medications (combined estrogen-progestin birth control pills, hormone-containing patches, vaginal rings, progestin-only contraception, continuous-use birth control pills); Hysterectomy",Pelvic exam; Ultrasound; Magnetic resonance imaging (MRI); Endometrial biopsy,Ibuprofen
Adjustment disorders,Adjustment disorders,"A mental health professional assesses major life stressors, symptoms, and their impact on daily life through a clinical interview focusing on medical, mental health, and social history.  Key diagnostic criteria include onset of emotional or behavioral symptoms within three months of a specific stressful event; disproportionate stress response to the event; symptoms not attributable to another mental health condition or typical grieving.","Talk therapy (individual, group, or family); Medications (antidepressants; anti-anxiety drugs)",Information not found,Antidepressants; Anti-anxiety drugs
Adnexal tumors and masses,Adnexal tumors and masses,"Diagnosis begins with a pelvic exam to palpate pelvic organs.  Imaging tests (ultrasound, CT scan, MRI) visualize the location and size of the mass. Blood tests may include a pregnancy test, infection tests, and tumor marker tests (e.g., CA-125).",No treatment (for small cysts); Surgery to remove the tumor or mass,Pelvic exam; Ultrasound; CT scan; MRI; Pregnancy test; Blood tests for infection; CA-125 test,Information not found
Adrenal cancer,Adrenal cancer,"Diagnosis begins with a physical exam, review of health and family history, and blood and urine tests to assess hormone levels (cortisol, aldosterone, androgens).  Imaging tests (CT, MRI, PET scans) are used to visualize adrenal growths and assess metastasis.  In some cases, surgical removal of the adrenal gland followed by pathological examination is necessary for diagnosis.",Surgery (adrenalectomy); Radiation therapy; Chemotherapy; Mitotane (Lysodren); Immunotherapy,Blood tests; Urine tests; CT scan; MRI scan; PET scan; Surgical removal of adrenal gland with pathological examination,Mitotane (Lysodren)
Adrenoleukodystrophy,Adrenoleukodystrophy,Review of symptoms and medical/family history; physical examination; blood testing to check for high levels of very long-chain fatty acids (VLCFAs) and to evaluate adrenal gland function; genetic testing for ALD-causing defects/mutations; MRI to detect brain abnormalities; vision screening (to monitor disease progression in males with no other symptoms); skin biopsy and fibroblast cell culture (in some cases).,"Stem cell transplantation; Adrenal insufficiency treatment (corticosteroid replacement therapy); Medications to relieve symptoms (stiffness, seizures); Physical therapy; Gene therapy (in clinical trials).",Blood testing; Genetic testing; MRI; Vision screening; Skin biopsy; Fibroblast cell culture,Corticosteroids
Adult attention-deficit/hyperactivity disorder (ADHD),Adult attention-deficit/hyperactivity disorder (ADHD),"Diagnosis involves a physical exam to rule out other conditions; information gathering about medical history, personal history, and symptom history; and the use of ADHD rating scales or psychological tests to evaluate symptoms.  No single test confirms the diagnosis. Core symptoms must begin before age 12 and continue into adulthood to be considered ADHD.",Medication; education; skills training; psychological counseling; psychotherapy; cognitive behavioral therapy; marital counseling; family therapy,Physical exam; ADHD rating scales; psychological tests,methylphenidate; amphetamine; atomoxetine; bupropion
Adult Still disease,Adult Still disease,No single test identifies adult Still disease.  Diagnosis is based on symptoms and ruling out other conditions with similar symptoms through blood tests and imaging.,Nonsteroidal anti-inflammatory drugs (NSAIDs); Steroids; Methotrexate; Biologic response modifiers; Exercise,Antinuclear antibody (ANA) test; C-reactive protein test; CT scan; Echocardiogram; Ferritin test; Sed rate (erythrocyte sedimentation rate); Ultrasound; X-ray,ibuprofen; naproxen sodium; prednisone; methotrexate (Trexall); anakinra (Kineret); canakinumab (Ilaris); tocilizumab (Actemra); etanercept (Enbrel); infliximab (Remicade); adalimumab (Humira); rituximab (Rituxan)
Age spots (liver spots),Age spots (liver spots),"Visual inspection by a doctor; Skin biopsy to distinguish age spots from other conditions, such as lentigo maligna.","Prescription bleaching creams (hydroquinone) alone or with retinoids (tretinoin) and a mild steroid; Laser and intense pulsed light therapies; Freezing (cryotherapy); Dermabrasion; Microdermabrasion; Chemical peel; Over-the-counter fade creams containing hydroquinone, glycolic acid, or kojic acid; Makeup to conceal spots.",Skin biopsy,Hydroquinone; Tretinoin
Agoraphobia,Agoraphobia,Based on symptoms; in-depth interview with a healthcare or mental health provider; physical exam to rule out other conditions.,Psychotherapy (cognitive behavioral therapy); Exposure therapy; Intensive outpatient program; Residential program; Medications (antidepressants; anti-anxiety medications),Physical exam,Fluoxetine (Prozac); Sertraline (Zoloft); Benzodiazepines
Airplane ear,Airplane ear,Diagnosis of airplane ear (ear barotrauma) is based on medical history and an examination of the ear with an otoscope.,"Time; Decongestant nasal sprays; Oral decongestants; Nonsteroidal anti-inflammatory drugs (ibuprofen, naproxen sodium); Acetaminophen; Valsalva maneuver; Myringotomy (rarely needed)",Otoscopic examination,Decongestant nasal sprays; Ibuprofen; Naproxen sodium; Acetaminophen
Albinism,Albinism,"Physical exam assessing skin and hair pigmentation; Thorough eye exam by an ophthalmologist, including retinal assessment; Comparison of pigmentation to family members; Review of medical history (including bleeding, bruising, infections); Genetic testing to determine type of albinism and genetic risk.","Eye care (annual eye exams, prescription lenses, possible eye muscle surgery for nystagmus or strabismus); Skin care and skin cancer prevention (annual skin exams); Specialized care for Hermansky-Pudlak or Chediak-Higashi syndromes.",Physical exam; Eye exam; Genetic testing,Information not found
Alcohol intolerance,Alcohol intolerance,"Physical exam; Skin test to identify potential allergies to ingredients in alcoholic beverages; Blood test to measure immunoglobulin E antibodies, though test accuracy is noted to be inconsistent.",Avoidance of alcohol or specific problematic beverages/ingredients; Over-the-counter or prescription antihistamines for minor reactions.,Skin test; Blood test,Over-the-counter antihistamines; Prescription antihistamines
Alcohol poisoning,Alcohol poisoning,"Assessment of visible signs and symptoms; blood and urine tests to check blood alcohol levels and identify other signs of alcohol toxicity, such as low blood sugar.",Monitoring to prevent breathing or choking problems; Oxygen therapy; Fluids given through a vein to prevent dehydration; Use of vitamins and glucose to prevent serious complications; Hemodialysis (for methanol or isopropyl alcohol ingestion),Blood test; Urine test,Information not found
Alcohol use disorder,Alcohol use disorder,"Assessment of drinking habits through questions; Physical exam to identify physical signs of alcohol-related complications; Review of lab test results (though no specific test diagnoses alcohol use disorder, patterns may suggest it); Psychological evaluation including questions about symptoms, thoughts, feelings, and behavior patterns; potentially questionnaires.","Brief intervention; Individual or group counseling; Outpatient program; Residential inpatient stay; Detoxification (medically managed withdrawal); Learning new skills and treatment planning (goal setting, behavior change techniques, self-help manuals, counseling, follow-up care); Psychological counseling (individual, group, couples, or family therapy); Oral medications; Injected medication; Aftercare programs; Support groups; Treatment for co-occurring mental health disorders; Medical treatment for alcohol-related health problems.",Lab tests; Imaging tests,Disulfiram; Naltrexone; Acamprosate; Vivitrol (injectable naltrexone)
Alcoholic hepatitis,Alcoholic hepatitis,"Diagnosis involves a physical exam, assessment of alcohol use history, liver function tests, blood tests, and imaging studies such as ultrasound, CT, or MRI scans. A liver biopsy may be performed if other tests are inconclusive or if other causes of hepatitis are suspected.",Quitting alcohol consumption; Special diet to address malnutrition; Medications to reduce liver swelling (inflammation);  Counseling; Alcoholics Anonymous or other support groups; Outpatient or live-in treatment program; Liver transplant (in severe cases and with stringent criteria),Liver function tests; Blood tests; Ultrasound; CT scan; MRI scan; Liver biopsy,Corticosteroids; Pentoxifylline; N-acetylcysteine
Allergies,Allergies,"Detailed questioning about symptoms; Physical exam; Detailed symptom and trigger diary (including food diary for food allergies); Skin prick test; Intradermal skin test; Specific IgE (sIgE) blood testing (also known as RAST or ImmunoCAP testing).  If other causes are suspected, additional tests may be necessary.","Avoidance of triggers; Medications (pills, liquids, nasal sprays, eye drops); Immunotherapy (shots or sublingual tablets); Emergency epinephrine (e.g., Auvi-Q, EpiPen)",Skin prick test; Intradermal skin test; Specific IgE (sIgE) blood test (RAST or ImmunoCAP test),"Epinephrine (e.g., Auvi-Q, EpiPen); Antihistamines (mentioned as affecting skin test results, but specific names not listed)"
Alpha-gal syndrome,Alpha-gal syndrome,"Alpha-gal syndrome is diagnosed based on patient history (tick bites, location of tick exposure, symptoms, time elapsed between red meat consumption and symptom onset) and medical tests.  A key diagnostic criterion is the presence of alpha-gal antibodies.  A physical exam may also be conducted.","Avoiding foods containing red meat or mammal-derived products (beef, pork, lamb, organ meats, gelatin); Epinephrine auto-injector for serious reactions",Blood test to measure alpha-gal antibodies; Skin test to assess reactivity to red meat,Epinephrine
Alzheimer's disease,Alzheimer's disease,"Diagnosis involves patient symptom description (with family input), memory and thinking skills tests, blood and imaging tests to rule out other causes and identify Alzheimer's-related brain proteins (plaques and tangles).  Biomarker tests, including amyloid and tau protein measurements in blood or cerebrospinal fluid, and PET scans (amyloid and tau PET, FDG PET) are increasingly used to detect the presence and stage of the disease.",Medications,"Physical and neurological exam; Blood tests (including beta-amyloid and tau protein levels); Mental status and neuropsychological testing; Brain imaging (MRI, CT, FDG PET, Amyloid PET, Tau PET)","donepezil (Aricept, Adlarity); galantamine; rivastigmine transdermal patch (Exelon); memantine (Namenda)"
Ameloblastoma,Ameloblastoma,"Diagnosis begins with imaging tests (X-ray, CT, and MRI scans) to determine the tumor's extent; a tissue or cell sample is then sent to a lab for testing to confirm the diagnosis.  The tumor may be incidentally found on routine dental X-rays.","Surgery to remove the tumor; Surgery to repair the jaw; Radiation therapy; Prosthetics; Supportive care (including dietitian, speech and language therapy, and physical therapy)",X-ray; CT scan; MRI scan; Tissue biopsy,Information not found
