Disease_Name_English,Disease_Name_Spanish,Diagnosis,Treatments,Tests,Medications_Drugs
Interstitial cystitis,Interstitial cystitis,"Diagnosis involves a medical history, bladder diary (recording fluid intake and urine output), pelvic exam (examining external genitals, vagina, cervix, abdomen, anus, and rectum), urine test (checking for UTI), cystoscopy (visualizing bladder lining, possibly with hydrodistention), biopsy (tissue sample from bladder and urethra for microscopic examination), urine cytology (cell examination to rule out cancer), and a potassium sensitivity test (comparing pain/urgency responses to water and potassium chloride solutions instilled into the bladder).",Physical therapy; Oral medications; Nerve stimulation (Transcutaneous electrical nerve stimulation (TENS); Sacral nerve stimulation); Bladder distention,Medical history and bladder diary; Pelvic exam; Urine test; Cystoscopy; Biopsy; Urine cytology; Potassium sensitivity test,ibuprofen; naproxen sodium; amitriptyline; imipramine; loratadine; pentosan polysulfate sodium (Elmiron)
Interstitial lung disease,Interstitial lung disease,"Diagnosis can be challenging, sometimes without identifiable cause.  Diagnosis involves ruling out other conditions with similar symptoms and may utilize high-resolution CT scans (often the first test), which show lung damage and fibrosis; blood tests to detect markers of autoimmune disease or inflammatory responses; pulmonary function tests (spirometry and diffusion capacity); oximetry; and sometimes lung tissue analysis via biopsy (bronchoscopy, bronchoalveolar lavage, or surgical biopsy).",Corticosteroid medications; Immune-suppressing drugs; Pirfenidone; Nintedanib; Medications to reduce stomach acid; Oxygen therapy; Pulmonary rehabilitation; Lung transplant,High-resolution CT scan; Blood tests; Echocardiogram; Spirometry; Diffusion capacity; Oximetry; Bronchoscopy; Bronchoalveolar lavage; Surgical biopsy,Prednisone; Pirfenidone; Nintedanib
Intestinal ischemia,Intestinal ischemia,"Diagnosis is suspected based on physical exam and symptoms; confirmed through blood tests (e.g., high white cell count), imaging tests (X-ray, ultrasound, CT scan, MRI, angiogram using CT or MRI), endoscopy (sigmoidoscopy, colonoscopy), and angiography (dye tracking blood flow through arteries).","Restoring blood supply to digestive tract; Antibiotics (for infection); Treatment of contributing conditions (e.g., congestive heart failure, irregular heartbeat); Cessation of vasoconstricting medications; Surgery (removal of damaged tissue, bypass of blockage); Angioplasty; Stent placement; Removal or dissolution of blood clots; Anticoagulant medication",Blood tests; X-ray; Ultrasound; CT scan; MRI; Angiogram; Sigmoidoscopy; Colonoscopy; Angiography,Antibiotics; Anticoagulant medication
Intestinal obstruction,Intestinal obstruction,"Diagnosis of intestinal obstruction involves a physical exam assessing abdominal swelling, tenderness, or lumps; listening for bowel sounds; and imaging studies to confirm the obstruction and identify its cause.  A standard X-ray may not reveal all obstructions; CT scans provide more detailed images; ultrasound is often preferred for children, especially those with suspected intussusception, which might show a ""bull's-eye"" pattern on ultrasound; air or barium enema can improve colon imaging and, in the case of intussusception, may also serve as treatment.","Hospitalization for stabilization (including IV fluids, nasogastric tube for decompression, urinary catheter); Barium or air enema (for intussusception); Low-fiber diet (for partial obstruction); Surgery (for complete obstruction or partial obstruction not resolving); Self-expanding metal stent (for select cases, often colon cancer or high-risk patients);  Medication to stimulate muscle contractions (for paralytic ileus); Treatment of underlying cause (for paralytic ileus); Decompression (via colonoscopy or surgery for enlarged colon).",Physical exam; Abdominal X-ray; Computerized tomography (CT) scan; Ultrasound; Air or barium enema,Information not found
Intracranial hematoma,Intracranial hematoma,Diagnosis can be challenging as initial symptoms may be absent. Loss of consciousness after head injury usually suggests intracranial hematoma until proven otherwise.  Imaging techniques are crucial for determining hematoma location and size.,Observation for neurological changes and intracranial pressure monitoring; Repeated head CT scans; Reversal of blood thinners (vitamin K and fresh frozen plasma); Surgical drainage; Craniotomy; Occupational and physical therapy,CT scan; MRI scan; Angiogram,warfarin (Jantoven); vitamin K
Intracranial venous malformations,Intracranial venous malformations,Intracranial venous malformations may be incidentally discovered during imaging tests for other neurological conditions.  Diagnosis is primarily through imaging studies revealing the characteristic vascular abnormalities.,"Medical management; Observation; Surgery (rarely, for hemorrhage); Medications for seizures and headaches",CT scan; CT angiogram; CT venogram; MRI; MRA; MRV,Information not found
Intussusception,Intussusception,"History taking including symptom review; physical exam (palpating a sausage-shaped lump); abdominal imaging (ultrasound, X-ray, CT scan) showing intestinal obstruction and a ""bull's-eye"" pattern indicative of intussusception;  assessment for intestinal perforation.",Water-soluble contrast or air enema; Surgery,Ultrasound; X-ray; CT scan; Barium enema,Information not found
Invasive lobular carcinoma,Invasive lobular carcinoma,"Diagnosis begins with a physical exam assessing breast changes; imaging tests (mammogram, ultrasound, MRI) are used to identify abnormalities; a tissue biopsy is necessary to confirm the presence of cancer and determine its type. Invasive lobular carcinoma is less likely to be detected on mammogram or ultrasound compared to other breast cancer types.","Surgery (lumpectomy, mastectomy); Radiation; Chemotherapy; Hormone therapy (endocrine therapy)","Clinical breast exam; Mammogram; Diagnostic mammogram; Breast ultrasound; Breast MRI; Breast biopsy; Blood tests (complete blood count, kidney and liver function tests); Bone scan; CT scan; PET scan; Sentinel node biopsy",Information not found
Iritis,Iritis,Complete eye exam including external examination with penlight observation of pupils and redness; visual acuity testing; slit-lamp examination with pupil dilation to visualize the inside of the eye;  further testing (blood tests or X-rays) may be necessary to identify underlying causes.,Steroid eyedrops; Dilating eyedrops; Oral steroids; Oral anti-inflammatory agents,External eye examination; Visual acuity testing; Slit-lamp examination; Pupil dilation; Blood tests; X-rays,Glucocorticoid eyedrops; Steroids (oral); Anti-inflammatory agents (oral)
Iron deficiency anemia,Iron deficiency anemia,"Diagnosis involves tests to assess red blood cell size and color, hematocrit, hemoglobin levels, and ferritin levels.  Low ferritin levels usually indicate low stored iron.  Further testing may be done to identify underlying causes.","Iron supplements; Treatment of underlying causes (e.g., medications for ulcers or heavy menstrual bleeding, surgery to remove polyps or fibroids); Intravenous iron; Blood transfusions (for severe cases)",Red blood cell size and color analysis; Hematocrit test; Hemoglobin test; Ferritin test; Endoscopy; Colonoscopy; Pelvic ultrasound,Oral iron tablets; Stool softeners; Oral contraceptives; Antibiotics (for peptic ulcers)
Irritable bowel syndrome,Irritable bowel syndrome,"Diagnosis is based on a medical history, physical exam, and exclusion of other conditions like celiac disease and IBD.  The Rome criteria, which include abdominal pain/discomfort at least one day a week for three months, often with defecation-related pain, altered stool frequency or consistency, are used. IBS is then categorized into subtypes (constipation-predominant, diarrhea-predominant, mixed, unclassified) based on symptoms.  Additional symptoms (e.g., onset after age 50, weight loss, rectal bleeding) may warrant further investigation.","Dietary changes (avoiding trigger foods, high-fiber diet, adequate hydration); Stress management; Lifestyle changes (regular exercise, sufficient sleep); Counseling; Fiber supplements; Laxatives; Antidiarrheal medicines; Bile acid binders; Anticholinergic medicines; Tricyclic antidepressants; SSRI antidepressants; Pain medicines",Colonoscopy; CT scan; Upper endoscopy; Biopsy; Lactose intolerance tests (breath test or dietary elimination); Breath test for bacterial overgrowth; Stool tests,psyllium husk (Metamucil); magnesium hydroxide oral (Milk of Magnesia); polyethylene glycol (Miralax); loperamide (Imodium A-D); cholestyramine (Prevalite); colestipol (Colestid); colesevelam (Welchol); dicyclomine (Bentyl); imipramine (Tofranil); desipramine (Norpramin); nortriptyline (Pamelor); fluoxetine (Prozac); paroxetine (Paxil); pregabalin (Lyrica); gabapentin (Neurontin); alosetron (Lotronex); eluxadoline (Viberzi); rifaximin (Xifaxan); lubiprostone (Amitiza); linaclotide (Linzess)
Ischemic colitis,Ischemic colitis,Diagnosis is based on symptoms and imaging tests to rule out other conditions like IBD.  Colonoscopy with biopsy helps confirm the diagnosis by visualizing the colon and examining tissue samples. Stool analysis helps rule out infection.,"Antibiotics; Intravenous fluids; Treatment of underlying conditions; Bowel rest; Surgery (to remove dead tissue, repair holes, or remove narrowed sections of the colon)",Abdominal CT scan; Colonoscopy; Biopsy; Stool analysis,Antibiotics
Itchy skin (pruritus),Itchy skin (pruritus),Diagnosis begins with a physical exam and review of medical history.  Further testing may be done if a medical condition is suspected.,"Corticosteroid creams and ointments; Calcineurin inhibitors (tacrolimus, pimecrolimus); Topical anesthetics; Capsaicin cream; Doxepin cream;  Selective serotonin reuptake inhibitors (SSRIs) (fluoxetine, sertraline); Tricyclic antidepressants (doxepin); Light therapy (phototherapy);  Moisturizing; Avoiding triggers; Medicated shampoos (zinc pyrithione, ketoconazole, selenium sulfide, coal tar); Calamine lotion; Creams with menthol, camphor, capsaicin, or pramoxine; Epsom salt baths; Baking soda baths; Oatmeal baths;  Counseling; Behavior modification therapy; Acupuncture; Meditation; Yoga; Nonprescription oral allergy medicine (diphenhydramine); Humidifier use",Blood test (complete blood count); Tests of liver and kidney function; Chest X-ray,Triamcinolone; Tacrolimus (Protopic); Pimecrolimus (Elidel); Fluoxetine (Prozac); Sertraline (Zoloft); Doxepin; Diphenhydramine
Jaw tumors and cysts,Jaw tumors and cysts,"Diagnosis of jaw tumors and cysts involves gathering information through imaging studies (X-ray, CT, MRI) and a biopsy to analyze tumor or cyst cells.  The pathologist examines the removed tissue during surgery to provide an immediate diagnosis.","Surgical removal of tumor or cyst;  Reconstruction of jawbone or other structures; Medical therapy; Supportive care (nutrition, speech and swallowing assistance, tooth replacements)",X-ray; CT; MRI; Biopsy,Information not found
Jellyfish stings,Jellyfish stings,Visual inspection of the injury by a healthcare provider;  Collection of stinger samples may be done to guide treatment.,Carefully plucking visible tentacles with tweezers; Soaking the affected skin in 110-113°F (43-45°C) water until pain eases (20-45 minutes); Applying 0.5% to 1% hydrocortisone cream or ointment twice daily; Cardiopulmonary resuscitation (CPR); Life support; Antivenom (for box jellyfish stings); Oral antihistamines; Oral corticosteroids; Oral pain medicine; Eye flushing (for stings near the eye).,Stinger sample collection,Hydrocortisone cream or ointment; Antihistamines; Corticosteroids; Oral pain medicine; Antivenom (for box jellyfish stings)
Jet lag disorder,Jet lag disorder,Information not found,"Light therapy; Lifestyle and home remedies (including sunlight exposure, caffeine, and exercise); Melatonin; Nonbenzodiazepines (zolpidem, eszopiclone, zaleplon); Benzodiazepines (temazepam, midazolam)",Information not found,zolpidem; eszopiclone; zaleplon; temazepam; midazolam; melatonin
Jock itch,Jock itch,Visual examination of the rash; Skin scraping for lab testing if diagnosis is uncertain.,Antifungal ointment; Antifungal cream; Antifungal gel; Prescription-strength creams; Prescription-strength ointments; Prescription-strength pills; Combination of prescription products.  Simultaneous treatment of athlete's foot if present.,Skin scraping,Information not found
Juvenile idiopathic arthritis,Juvenile idiopathic arthritis,"Diagnosis is challenging due to overlapping symptoms with other conditions.  No single test confirms diagnosis; tests help rule out other conditions.  Evaluation includes assessment of symptoms, physical examination, and various blood tests to assess inflammation and autoantibodies. Imaging (X-ray or MRI) may be used to exclude other causes and monitor bone development/joint damage.","Medications; Physical therapy; Occupational therapy; Surgery; Lifestyle modifications (exercise, diet, heat/cold application)",Erythrocyte sedimentation rate (ESR); C-reactive protein; Antinuclear antibody; Rheumatoid factor; Cyclic citrullinated peptide (CCP); X-ray; Magnetic resonance imaging (MRI),Ibuprofen; Naproxen sodium; Methotrexate; Etanercept; Adalimumab; Golimumab; Infliximab; Abatacept; Rituximab; Anakinra; Tocilizumab; Prednisone
Kaposi sarcoma,Kaposi sarcoma,"Diagnosis is confirmed through a skin biopsy, which involves removing a small piece of a skin lesion for lab testing to look for signs of cancer.  Further testing may be needed to detect Kaposi sarcoma in other areas of the body such as the lungs or digestive tract depending on the symptoms and location of lesions.",Monitoring; Minor surgery (excision); Cryotherapy; Radiation therapy; Vinblastine injection; Topical medicine cream or gel; Chemotherapy; Antiviral medications (for AIDS-related Kaposi sarcoma); Cessation or change of immunosuppressant medications (for transplant-related Kaposi sarcoma),Skin biopsy; Fecal occult blood test; Endoscopy; Colonoscopy; CT scan of the abdomen and pelvis; Chest X-ray; CT scan of the chest; Bronchoscopy,Vinblastine; Antiviral medications
Kawasaki disease,Kawasaki disease,"There is no single test; diagnosis involves ruling out other diseases with similar symptoms (scarlet fever, juvenile rheumatoid arthritis, Stevens-Johnson syndrome, toxic shock syndrome, measles, tick-borne illnesses) through physical exam and blood and urine tests showing signs like high white blood cell count, anemia, and inflammation.","Gamma globulin intravenous therapy; High-dose aspirin (then lowered after fever subsides); Low-dose aspirin (for at least six weeks post-fever, potentially longer depending on heart issues); Follow-up tests for heart problems (6-8 weeks and six months post-illness); Referral to pediatric cardiologist if needed.",Blood tests; Electrocardiogram (ECG or EKG); Echocardiogram; Complete blood count (CBC),Gamma globulin; Aspirin
Keloid scar,Keloid scar,Visual examination of the affected skin; Skin biopsy to rule out skin cancer.,Compression dressings; Corticosteroid cream; Cortisone or other steroid injections; Cryotherapy (liquid nitrogen freezing); Pulsed-dye laser treatment; Radiation therapy; Surgical removal,Skin biopsy,Corticosteroid cream; Cortisone; Other steroids
Keratitis,Keratitis,Diagnosis involves a comprehensive eye exam using a penlight to assess pupil reaction and size; corneal staining to visualize damage; slit-lamp examination for detailed assessment of keratitis and its effects on other eye structures; and laboratory analysis of tear samples or corneal cells to identify the cause.,Artificial tear drops; Topical eye medications; Antibiotic eye drops; Oral antibiotics; Antifungal eye drops; Oral antifungal medication; Antiviral eye drops; Oral antiviral medications; Antiparasitic eye drops; Cornea transplant,Eye exam; Penlight exam; Corneal staining; Slit-lamp exam; Laboratory analysis of tears or corneal cells,Antibiotic eye drops; Oral antibiotics; Antifungal eye drops; Oral antifungal medication; Antiviral eye drops; Oral antiviral medications; Antiparasitic eye drops
Keratoconus,Keratoconus,Review of medical and family history; eye exam; assessment of corneal shape using various tests.,Corneal collagen cross-linking; Eyeglasses; Soft contact lenses; Hard contact lenses (rigid gas permeable); Piggyback lenses; Hybrid lenses; Scleral lenses; Intrastromal corneal ring segments (ICRS); Cornea transplant (keratoplasty),Eye refraction; Slit-lamp examination; Keratometry; Computerized corneal mapping (including corneal tomography and corneal topography),Riboflavin eye drops (used in corneal cross-linking)
Keratosis pilaris,Keratosis pilaris,Visual examination of the affected skin by a healthcare provider; No other testing is typically needed.,"Time; Moisturizing; Self-care measures; Medicated creams (topical exfoliants containing alpha hydroxy acid, lactic acid, salicylic acid, or urea); Topical retinoids (e.g., tretinoin, tazarotene);  Warm water bathing; Gentle skin cleansing; Moisturizing with lanolin, petroleum jelly, or glycerin; Humidifier use; Avoidance of tight clothing.",Information not found,Tretinoin; Tazarotene
Kidney cancer,Kidney cancer,"Kidney cancer diagnosis often begins with a physical exam and a discussion of health history.  Blood and urine tests may reveal clues; imaging tests (ultrasound, CT, MRI) show location and size of cancer; a biopsy (tissue sample) may be taken for lab testing, though not always necessary if imaging provides sufficient information.","Surgery (partial nephrectomy; radical nephrectomy - open, laparoscopic, or robot-assisted); Cryoablation; Medication (mentioned post-surgery to lower recurrence risk, but no specific medications named)",Blood and urine tests; Ultrasound; CT scan; MRI; Biopsy,Information not found
Kidney cysts,Kidney cysts,"Imaging tests (MRI, CT, and ultrasound) are used to differentiate kidney cysts from tumors; blood tests assess kidney function.","Observation (if asymptomatic and no kidney function impairment); Percutaneous aspiration and sclerotherapy (piercing and draining the cyst, then filling it with a solution such as alcohol or a chemical compound); Surgery (to remove the cyst, typically for large cysts causing symptoms or complex cysts).",MRI; CT; Ultrasound; Blood tests,Information not found
Kidney infection,Kidney infection,"Urine sample analysis for bacteria, blood, or pus; Blood culture to check for bacteria or other organisms; Ultrasound; CT scan; Voiding cystourethrogram (X-ray of bladder during filling and urination).",Antibiotics; Hospitalization (for severe infections); Surgery (for underlying structural problems); Fluid administration through a vein (for severe infections),Urinalysis; Blood culture; Ultrasound; CT scan; Voiding cystourethrogram,Acetaminophen; Ibuprofen
Kidney stones,Kidney stones,"Physical exam; Blood tests to check calcium and uric acid levels and kidney health; 24-hour urine collection to assess stone-forming minerals and inhibitors; Imaging tests such as CT scans (including high-speed or dual-energy CT for uric acid stones), abdominal X-rays (less common), and ultrasound; Analysis of passed stones to determine chemical composition; Genetic testing for rare inherited conditions like cystinuria and primary hyperoxaluria.",Increased water intake; Pain relievers; Alpha blockers; Extracorporeal shock wave lithotripsy (ESWL); Percutaneous nephrolithotomy; Ureteroscopy; Parathyroid gland surgery,Blood tests; 24-hour urine collection; CT scan; High-speed/dual energy CT scan; Abdominal X-ray; Ultrasound; Analysis of passed stones; Genetic testing,Ibuprofen; Naproxen sodium; Tamsulosin; Dutasteride and tamsulosin (Jalyn)
Kleptomania,Kleptomania,"Diagnosis is based on symptoms and a psychological evaluation; a physical exam may rule out medical causes;  assessment includes questioning about impulses, triggering situations, and consequences of the behavior; use of questionnaires and self-assessments; application of DSM-5 criteria.","Psychotherapy (cognitive behavioral therapy including systematic desensitization, counter-conditioning, covert sensitization, aversion therapy); medication; self-help groups.",Physical exam; Psychological evaluation; Questionnaires; Self-assessments,Naltrexone; Selective serotonin reuptake inhibitor (SSRI); Other unspecified medications.
Klinefelter syndrome,Klinefelter syndrome,"Physical exam assessing genital area, chest, and developmental milestones; questioning about symptoms and health; hormone testing via blood tests to detect hormonal imbalances; chromosome analysis (karyotype) via blood sample to confirm chromosomal abnormality; prenatal diagnosis may be possible through tests on fetal cells or cell-free DNA in maternal blood.","Testosterone therapy; Breast tissue removal (surgery); Speech and language therapy; Physical therapy; Occupational therapy; Educational evaluation and support; Fertility treatment (ICSI); Mental health support (psychotherapy, counseling)",Hormone testing (blood test); Chromosome analysis (karyotype); Prenatal testing (fetal cells or cell-free DNA in maternal blood),Testosterone therapy
Klippel-Trenaunay syndrome,Klippel-Trenaunay syndrome,"Diagnosis begins with a physical exam assessing for swelling, varicose veins, port-wine stains, and bone/soft tissue growth.  Referral to a vascular malformations specialist is recommended.  Further evaluation uses several diagnostic tests to determine the type and severity of the condition.","Compression therapy (bandages, elastic garments, intermittent pneumatic compression devices); Skin care; Physical therapy; Orthopedic devices (shoes, inserts); Epiphysiodesis; Embolization; Laser therapy; Laser or radiofrequency ablation of veins; MR-guided ablation; Sclerotherapy; Surgery (vein removal/reconstruction, tissue removal, bone overgrowth correction); Oral medications for complex vascular/lymphatic malformations; Topical sirolimus",Duplex ultrasound scanning; MRI; MR angiography; Scanogram; CT scan; CT angiography; Contrast venography; Coagulation studies; Genetic studies,"Topical sirolimus; Oral medications (unspecified, with a note about potential significant side effects)"
Knee bursitis,Knee bursitis,"Physical exam comparing both knees, assessing for warmth, swelling, pain source, skin changes, and range of motion;  Patient medical history review.  Imaging tests may be used to rule out other conditions.",Rest; Pain relievers; Ice application; Gentle compression; Elevation of knee; Weight loss (if needed); Physical therapy; Corticosteroid injection; Aspiration; Surgery (rarely),X-ray; MRI; Ultrasound; Aspiration (of bursa fluid),Aspirin; Ibuprofen; Naproxen sodium; Antibiotics (if infection present)
Knee pain,Knee pain,"Physical exam inspecting the knee for swelling, pain, tenderness, warmth, and bruising; assessment of lower leg movement range; evaluation of joint integrity.","Physical therapy; Strengthening exercises; Exercises to correct movement patterns; Flexibility and balance exercises; Arch supports; Braces; Corticosteroid injections; Hyaluronic acid injections; Platelet-rich plasma (PRP) injections; Arthroscopic surgery; Partial knee replacement surgery; Total knee replacement; Osteotomy; Over-the-counter medications (ibuprofen, naproxen sodium); Creams with lidocaine or capsaicin; Rest; Ice; Heat; Compression; Elevation; Acupuncture",X-ray; Computerized tomography (CT) scan; Ultrasound; Magnetic resonance imaging (MRI); Blood tests; Arthrocentesis,Ibuprofen; Naproxen sodium; Corticosteroids; Hyaluronic acid
Kyphosis,Kyphosis,Physical exam including assessment of spinal curvature through forward bending; Neurological exam to check reflexes and muscle strength; X-rays to determine curvature and vertebral deformities; CT scan for detailed imaging; MRI to detect recent fractures; Nerve tests to evaluate nerve impulse transmission if numbness or muscle weakness is present; Bone density tests to assess risk of compression fractures.,Pain relievers; Osteoporosis medications; Exercises; Bracing; Spinal fusion,X-rays; CT scan; MRI; Nerve tests; Bone density tests,acetaminophen; ibuprofen; naproxen sodium; Osteoporosis medications (specific names not listed)
Lactose intolerance,Lactose intolerance,Diagnosis is suspected based on symptoms and response to reduced dairy intake. Confirmation is done via hydrogen breath test (measuring hydrogen in breath after lactose ingestion); lactose tolerance test (measuring blood glucose levels two hours after lactose ingestion).,"Treating underlying conditions (if present); Low-lactose diet;  Using lactase enzyme tablets or drops; Gradually introducing dairy products; Choosing smaller dairy servings; Consuming dairy with meals; Experimenting with various dairy products (hard cheeses, yogurt); Using lactose-reduced or lactose-free products",Hydrogen breath test; Lactose tolerance test,Lactaid (and other lactase enzyme products)
Laryngitis,Laryngitis,"The most common sign is hoarseness, varying from mild to complete voice loss.  A medical history review, voice examination, and vocal cord examination are conducted.  Referral to an ENT specialist may occur. Diagnostic techniques include laryngoscopy (using a mirror or fiber-optic endoscope) and biopsy (if suspicious areas are observed).","Voice rest; Increased fluid intake; Humidified air; Treatment of underlying causes (e.g., heartburn, smoking, alcohol overuse); Antibiotics (if bacterial infection); Corticosteroids (in urgent cases, such as croup in toddlers); Voice therapy; Surgery (in some cases)",Laryngoscopy; Fiber-optic laryngoscopy; Biopsy,Antibiotics; Corticosteroids
