Disease_Name_English,Disease_Name_Spanish,Diagnosis,Treatments,Tests,Medications_Drugs
Premenstrual syndrome (PMS),Premenstrual syndrome (PMS),"There are no unique physical findings or lab tests to diagnose PMS definitively. Diagnosis is based on a predictable premenstrual symptom pattern recorded over at least two menstrual cycles;  Tests may be done to rule out other conditions mimicking PMS, such as thyroid disorders or mood disorders.","Lifestyle changes (diet modification, exercise, stress reduction); Medication",Thyroid function test; Mood screening tests,"fluoxetine (Prozac); paroxetine (Paxil, Pexeva); sertraline (Zoloft); ibuprofen (Advil, Motrin IB); naproxen sodium (Aleve); spironolactone (Aldactone); Hormonal contraceptives (combination birth control pills; minipill)"
Presbyopia,Presbyopia,"Presbyopia is diagnosed through a basic eye exam including a refraction assessment (to determine nearsightedness, farsightedness, astigmatism, or presbyopia) and an eye health exam (often involving pupil dilation).  The refraction assessment involves testing distance and close-up vision using various instruments and lenses.","Corrective eyeglasses (including prescription reading glasses, bifocals, trifocals, progressive multifocals, and office progressives); Contact lenses (bifocal, monovision, modified monovision); Refractive surgery (conductive keratoplasty, LASIK, LASEK, PRK); Lens implants; Corneal inlays",Refraction assessment; Eye health exam,Information not found
Prescription drug abuse,Prescription drug abuse,"Diagnosis is based on medical history, answers to questions, and sometimes, signs and symptoms; Blood or urine tests can detect many types of drugs and track treatment progress.","Counseling; Withdrawal (detoxification); Addiction medicine; Recovery support; Opioid tapering; Medication to manage withdrawal symptoms (e.g., clonidine, buprenorphine, buprenorphine-naloxone, methadone, naltrexone);  Long-term medications (e.g., naltrexone (Vivitrol), buprenorphine (Sublocade));  Treatment for stimulant withdrawal focusing on tapering and symptom relief.",Blood test; Urine test,Clonidine (Catapres); Buprenorphine; Buprenorphine-naloxone (Suboxone); Methadone; Naltrexone (Vivitrol); Buprenorphine (Sublocade)
Preterm labor,Preterm labor,"Regular uterine contractions and cervical softening, thinning, and dilation (opening) before 37 weeks of pregnancy;  Diagnosis is based on a review of medical history, risk factors, and symptoms; Pelvic exam assesses uterine firmness, tenderness, cervical dilation, and bleeding (if water hasn't broken and placenta previa is not suspected); Transvaginal ultrasound measures cervical length, assesses fetal size and position, and checks for fetal/placental issues and amniotic fluid volume; Uterine monitoring assesses contraction duration and frequency; Vaginal swab checks for infections and fibronectin; Urine sample checks for bacteria.",Cervical cerclage; Vaginal progesterone; Corticosteroids; Magnesium sulfate; Tocolytics; Bed rest (note: not shown to be effective in reducing preterm birth risk),Pelvic exam; Transvaginal ultrasound; Uterine monitoring; Vaginal swab; Urine sample,Corticosteroids; Magnesium sulfate; Tocolytics
Priapism,Priapism,"An erection lasting more than four hours requires emergency care.  The doctor will determine if it's ischemic or nonischemic priapism through a medical history, genital/abdominal/groin/perineum exam, and assessment of pain and penile rigidity.  The type of priapism may be evident from these factors.  Further tests may be needed to confirm the type and identify underlying causes.","Aspiration decompression (draining blood from the penis, possibly with saline flush); Medication injection (e.g., phenylephrine); Surgery (to drain blood, reroute blood flow);  Watch-and-wait approach (for nonischemic priapism); Ice packs and perineum pressure (for nonischemic priapism); Surgery to insert temporary blood flow blocking material; Surgery to repair arteries or tissue damage.",Penile blood gas measurement; Blood tests (red blood cell and platelet counts); Doppler ultrasonography; Toxicology test (blood or urine),Phenylephrine
Primary biliary cholangitis,Primary biliary cholangitis,"Diagnosis involves a review of health and family history, physical exam, and various tests to detect liver disease and bile duct injury;  key diagnostic criterion is the presence of anti-mitochondrial antibodies (AMAs), although some patients may be AMA-negative;  imaging and liver biopsy may be used to confirm diagnosis and assess disease extent.","Ursodeoxycholic acid (UDCA); Obeticholic acid; Fibrates; Budesonide; Liver transplant;  Treatment for fatigue (including thyroid disease exclusion); Treatment for itching (antihistamines, cholestyramine, rifampin, opioid antagonists, sertraline); Treatment for dry eyes and mouth; Vitamin and mineral supplements; Cholesterol-lowering medication; Treatment for bone loss; Treatment for portal hypertension (diet modification, diuretics, paracentesis).",Blood tests (liver tests; antibody tests for AMAs; cholesterol test); Ultrasound; FibroScan; MRCP; MRE; Liver biopsy,"Ursodeoxycholic acid (UDCA or ursodiol); Obeticholic acid (Ocaliva); Fibrates (e.g., Tricor); Budesonide;  Antihistamines (diphenhydramine; hydroxyzine hydrochloride; loratadine); Cholestyramine; Rifampin; Opioid antagonists (containing naloxone and naltrexone); Sertraline; Statins;  Diuretics; Calcium; Vitamin D; Vitamin A; Vitamin E; Vitamin K; Folic acid; Iron."
Primary immunodeficiency,Primary immunodeficiency,"A review of medical history, including family history of inherited immune system disorders; physical examination; blood tests to assess levels of infection-fighting proteins (immunoglobulins), blood cells, and immune system cells; prenatal testing (amniotic fluid, blood, or chorionic villus sampling) and possibly DNA testing for genetic defects in pregnancies where a child has already been diagnosed with primary immunodeficiency.",Treating infections with antibiotics (potentially long-term or intravenous); Preventing infections with long-term antibiotics; Immunoglobulin therapy (IV or subcutaneous infusion); Stem cell transplantation; Gene therapy; Enzyme replacement therapy; Thymus transplantation,"Blood tests; Prenatal testing (amniotic fluid, blood, or chorion sampling); DNA testing",Antibiotics
Primary lateral sclerosis (PLS),Primary lateral sclerosis (PLS),"There is no single test to confirm PLS; diagnosis relies on ruling out other conditions through medical history review, neurological exam, and various tests;  a definitive diagnosis may take 3-4 years due to symptom overlap with ALS.  Genetic testing may be used in cases of juvenile PLS.",Medication to relieve symptoms; Physical and occupational therapies; Speech and language therapy; Nutrition support; Assistive devices,Bloodwork; MRI; Electromyogram (EMG); Nerve conduction studies; Lumbar puncture,Baclofen; Tizanidine; Clonazepam; Amitriptyline; Antidepressants
Primary ovarian insufficiency,Primary ovarian insufficiency,"Irregular periods or difficulty conceiving; physical exam including pelvic exam; review of menstrual cycle, toxin exposure (chemotherapy, radiation), and previous ovarian surgery.",Estrogen therapy; Progesterone therapy (if uterus present); Calcium and vitamin D supplements; In vitro fertilization (using donor eggs),"Pregnancy test; Hormone level blood test (FSH, estradiol, prolactin); Karyotype analysis; FMR1 gene test; Bone density test",Estrogen; Progesterone; Calcium supplements; Vitamin D supplements
Primary progressive aphasia,Primary progressive aphasia,"Progressive communication difficulties worsening over 2-3 years without significant changes in thinking or behavior; neurological exam; speech-language evaluation; neuropsychological evaluation assessing speech, language comprehension, object recognition, naming, recall, and other cognitive factors.",Speech and language therapy; Physical therapy; Occupational therapy,Neurological exam; Speech-language evaluation; Neuropsychological evaluation; Blood tests; Lumbar puncture; Genetic tests; Brain MRI; FDG PET scan; Other PET scans (for Alzheimer's-related proteins),Information not found
Primary sclerosing cholangitis,Primary sclerosing cholangitis,"Diagnosis of primary sclerosing cholangitis is primarily achieved through magnetic resonance cholangiopancreatography (MRCP), which visualizes the liver and bile ducts.  Endoscopic retrograde cholangiopancreatography (ERCP) may be used if MRCP is unavailable or inconclusive, or if symptoms persist despite normal MRCP findings.  Liver biopsy may be used to assess the extent of liver damage if the diagnosis remains uncertain after less invasive testing.",Treatment for itching (bile acid sequestrants; rifampin; antihistamines; opioid antagonists; ursodeoxycholic acid); Treatment for infections (antibiotics); Nutrition support (vitamin supplements; calcium and vitamin D supplements); Treatment for bile duct blockages (balloon dilation; stent placement); Liver transplant,Liver function blood test; MRI of bile ducts (MRCP); X-rays of bile ducts (ERCP); Liver biopsy,Rifampin; Antihistamines; Naltrexone; Ursodeoxycholic acid (UDCA)
Proctitis,Proctitis,"Proctitis is diagnosed through a combination of patient symptoms (rectal pain, bleeding, frequent bowel movements), physical examination, and various diagnostic tests to identify the underlying cause of inflammation.","Medications to treat infection (antibiotics or antivirals); Medications to control inflammation (sucralfate, mesalamine, sulfasalazine, metronidazole); Stool softeners; Dilation; Ablation procedures (argon plasma coagulation, cryoablation, electrocoagulation); Surgery (for inflammatory bowel disease); Corticosteroids (prednisone, budesonide); Immunosuppressants (azathioprine, infliximab)",Blood tests; Stool test; Flexible sigmoidoscopy; Colonoscopy; Tests for sexually transmitted infections; Needle biopsy,doxycycline; acyclovir; sucralfate; mesalamine; sulfasalazine; metronidazole; prednisone; budesonide; azathioprine; infliximab
Progeria,Progeria,"Suspicion based on symptoms; confirmation via genetic testing for LMNA gene changes; thorough physical exam including height/weight measurement, growth curve charting, hearing and vision testing, vital signs measurement, and observation of visible symptoms.","Regular monitoring for heart and blood vessel disease; Lonafarnib; low-dose aspirin; other medications (as needed for complications, including dietary therapy, statins, blood thinners); physical therapy; occupational therapy; nutrition management (including supplements); hearing aids; eye and vision care; dental care; coronary angioplasty and stents; coronary artery bypass surgery.",Genetic test for LMNA gene; electrocardiograms; echocardiograms; X-ray; MRI; vision exams; hearing exams.,Lonafarnib (Zokinvy); low-dose aspirin; statins; blood thinners.
Progressive supranuclear palsy,Progressive supranuclear palsy,"Diagnosis is challenging due to symptom overlap with Parkinson's disease.  Suspicion arises if the patient lacks tremors, experiences frequent falls, shows little or no response to Parkinson's medications, and has difficulty moving their eyes downward. Brain shrinkage in specific regions may be visible on MRI.  MRI also helps rule out mimicking disorders like stroke.  PET scan may detect early brain changes not apparent on MRI.",Parkinson's disease medications; OnabotulinumtoxinA (Botox) injections; Antidepressants; Eyeglasses with bifocal or prism lenses; Speech and swallowing evaluations; Physical therapy; Occupational therapy; Facial exercises; Gait and balance training,MRI; PET scan,Parkinson's disease medications; OnabotulinumtoxinA (Botox); Antidepressants
Prolactinoma,Prolactinoma,Diagnosis involves assessing signs and symptoms suggestive of prolactinoma; blood tests to measure prolactin and other pituitary hormones; pregnancy test for females of childbearing age; brain MRI to detect the tumor; and vision tests to assess visual impact.  Referral to an endocrinologist may be necessary for additional testing.,Medications; Surgery,Blood tests; Pregnancy test; MRI scan; Vision tests,"Cabergoline; Bromocriptine (Cycloset, Parlodel)"
Prostate cancer,Prostate cancer,"Prostate cancer diagnosis often begins with a digital rectal exam and a prostate-specific antigen (PSA) blood test.  If these tests reveal concerning results, imaging tests (ultrasound, MRI) may be used to visualize the prostate. A prostate biopsy is performed to confirm the presence of cancer cells.",Information not found,"Prostate-specific antigen (PSA) blood test; Digital rectal exam; Prostate ultrasound; Prostate MRI (including contrast-enhanced MRI, MRI with endorectal coil, multiparametric MRI); Prostate biopsy",Information not found
Prostatitis,Prostatitis,"Diagnosis involves a physical exam, review of symptoms and medical history, and diagnostic tests to assess for infection and other potential causes.  A urologist may be consulted.","Antibiotics (for bacterial prostatitis); Alpha-blockers (to relax bladder neck and muscle fibers); Pain medication;  Acupuncture; Biofeedback;  Sitz baths; Lifestyle modifications (limiting alcohol, caffeine, spicy foods; increased water intake)",Digital rectal exam; Urine test; Blood test; Prostatic specimen test (prostate fluid sample after massage); Urodynamic tests; Imaging tests,Antibiotics; Alpha-blockers; Acetaminophen; Ibuprofen; Rye grass pollen extract (Cernilton)
Pseudobulbar affect,Pseudobulbar affect,"Diagnosed during a neurological evaluation by internists, neuropsychologists, neurologists, and psychiatrists;  Diagnosis involves assessing the characteristics of emotional outbursts, differentiating PBA from other conditions like depression, bipolar disorder, and anxiety.  Key information includes details about the emotional outbursts (voluntary or involuntary, duration, appropriateness, trigger, reflection of true emotions, impact on social interactions).",Medication; Occupational therapy,Information not found,Dextromethorphan hydrobromide and quinidine sulfate (Nuedexta); Tricyclic antidepressants (TCAs); Selective serotonin reuptake inhibitors (SSRIs)
Pseudocholinesterase deficiency,Pseudocholinesterase deficiency,Suspected when problems with muscle control and breathing occur after succinylcholine administration; confirmed by blood test measuring pseudocholinesterase enzyme levels; genetic testing identifies the gene change causing inherited deficiency.,Avoiding succinylcholine; using alternative muscle relaxants; mechanical ventilation support; sedation.,Blood test; Genetic testing,Succinylcholine; procaine; tetracaine; benzocaine; cocaine
Pseudogout,Pseudogout,Symptoms mimic gout and other arthritis types; lab and imaging tests confirm diagnosis; joint aspiration (arthrocentesis) to analyze joint fluid for crystals; X-rays reveal joint damage and crystal deposits.,Medications; Joint drainage; Rest; Ice; Over-the-counter NSAIDs,"Blood tests for thyroid, parathyroid issues, and mineral imbalances; Joint aspiration (arthrocentesis); X-rays",Naproxen; Indomethacin; Colchicine; Prednisone; Ibuprofen; Naproxen sodium
Pseudomembranous colitis,Pseudomembranous colitis,Diagnosis is based on stool sample tests for *Clostridioides difficile* (C. difficile); blood tests may show leukocytosis (high white blood cell count) indicating infection; colonoscopy or sigmoidoscopy visualizes characteristic lesions (raised yellow plaques) and swelling in the colon; imaging tests (abdominal X-ray or CT scan) may be used to identify complications like toxic megacolon or colon rupture.,"Stopping the causative antibiotic if possible; Antibiotic treatment (e.g., vancomycin, fidaxomicin, metronidazole); Fecal microbial transplantation (FMT); Surgery (total or subtotal colectomy; loop ileostomy and colonic lavage); Bezlotoxumab (Zinplava)",Stool sample; Blood tests; Colonoscopy; Sigmoidoscopy; Abdominal X-ray; Abdominal CT scan,Vancomycin; Fidaxomicin (Dificid); Metronidazole (Flagyl); Bezlotoxumab (Zinplava)
Pseudotumor cerebri (idiopathic intracranial hypertension),Pseudotumor cerebri (idiopathic intracranial hypertension),"Review of symptoms and medical history; physical examination; eye exams (assessing optic nerve swelling, visual field testing, retinal thickness measurement via optical coherence tomography); brain imaging (MRI or CT scan to rule out other conditions); lumbar puncture (to measure intracranial pressure and analyze spinal fluid).",Low-sodium weight-loss diet; Weight-loss programs; Gastric surgery; Optic nerve sheath fenestration; Spinal fluid shunt; Venous sinus stenting,Eye exam; Visual field test; Optical coherence tomography; MRI; CT scan; Lumbar puncture,Acetazolamide; Other diuretics; Migraine medications
Psoriasis,Psoriasis,"Physical examination of skin, scalp, and nails; skin biopsy to determine type of psoriasis and rule out other disorders.",Topical therapy; Light therapy; Oral or injected medications,Skin biopsy,hydrocortisone; triamcinolone; clobetasol; calcipotriene; calcitriol; tazarotene; tacrolimus; pimecrolimus; salicylic acid; coal tar; anthralin; acitretin; etanercept; infliximab; adalimumab; ustekinumab; risankizumab-rzaa; ixekizumab; guselkumab; apremilast; bimekizumab-bkzx; secukinumab; methotrexate
Psoriatic arthritis,Psoriatic arthritis,"Diagnosis involves a physical exam checking joints for swelling/tenderness and fingernails for abnormalities;  no single test confirms psoriatic arthritis, but tests rule out other conditions like rheumatoid arthritis or gout.  X-rays pinpoint joint changes; MRI assesses tendons and ligaments;  rheumatoid factor (RF) blood test differentiates from rheumatoid arthritis; joint fluid test helps distinguish from gout.","Disease-modifying antirheumatic drugs (DMARDs); NSAIDs; Physical therapy; Occupational therapy; Massage therapy; Steroid injections; Joint replacement surgery; Self-care strategies (joint protection, weight management)",X-rays; MRI; Rheumatoid factor (RF) blood test; Joint fluid test,"methotrexate (Trexall, Otrexup); leflunomide (Arava); sulfasalazine (Azulfidine); adalimumab (Humira); certolizumab (Cimzia); etanercept (Enbrel); golimumab (Simponi); infliximab (Remicade); ustekinumab (Stelara); secukinumab (Cosentyx); ixekizumab (Taltz); guselkumab (Tremfya); abatacept (Orencia); tofacitinib (Xeljanz); apremilast (Otezla); ibuprofen (Advil, Motrin IB); naproxen sodium (Aleve)"
Pubic lice (crabs),Pubic lice (crabs),"Visual examination of the pubic area to identify moving lice; presence of lice eggs (nits), although nits may remain after successful treatment.","Over-the-counter lotions or shampoos with 1% permethrin (Nix) or pyrethrin; prescription lotions such as malathion; oral medication ivermectin (Stromectol); petroleum jelly application for eyelashes and eyebrows; nit comb or fingernails to remove lice and nits; topical ointment (if needed); washing contaminated items in hot, soapy water; dry cleaning or sealing unwashable items.",Visual examination,Permethrin (Nix); Pyrethrin; Malathion; Ivermectin (Stromectol)
Pulmonary atresia,Pulmonary atresia,Pulmonary atresia is usually diagnosed soon after birth; diagnosis relies primarily on echocardiogram which shows blood flow through the heart and heart valves; pulse oximetry may indicate low blood oxygen levels suggesting a heart or lung problem; chest X-ray assesses heart and lung size and shape; electrocardiogram (ECG or EKG) records the heart's electrical activity.,Balloon atrial septostomy; Stent placement in the ductus arteriosus; Shunting; Glenn procedure; Fontan procedure; Heart transplant; Surgery to patch ventricular septal defect (VSD) and create a connection from the right pumping chamber to the pulmonary artery (potentially using an artificial valve); IV medication to keep the ductus arteriosus open (short-term).,Pulse oximetry; Chest X-ray; Electrocardiogram (ECG or EKG); Echocardiogram (including fetal echocardiogram); Cardiac catheterization,Information not found
Pulmonary atresia with ventricular septal defect,Pulmonary atresia with ventricular septal defect,"Pulmonary atresia with ventricular septal defect (PA-VSD) is often diagnosed during pregnancy or soon after birth using tests such as pulse oximetry, chest X-ray, echocardiogram (including fetal echocardiogram), electrocardiogram (ECG or EKG), cardiac catheterization, and heart CT scan.  The presence of major aortopulmonary collateral arteries (MAPCAs) is also assessed as it influences treatment planning.","Catheter procedure (including stent placement in patent ductus arteriosus); Systemic-to-pulmonary artery shunt (e.g., Blalock-Taussig shunt); Complete repair; Unifocalization",Pulse oximetry; Chest X-ray; Echocardiogram; Electrocardiogram (ECG or EKG); Cardiac catheterization; Heart CT scan,Information not found
Pulmonary edema,Pulmonary edema,"Diagnosis is based on symptoms, physical exam, and results of diagnostic tests.  A history of cardiovascular or lung disease is considered once the condition is more stable.",Oxygen therapy; Mechanical ventilation; Positive airway pressure; Diuretics; Blood pressure drugs; Inotropes; Morphine;  Descending to lower elevation (for HAPE); Stopping exercise and staying warm (for HAPE),Chest X-ray; Chest computerized tomography (CT) scan; Pulse oximetry; Arterial blood gas test; B-type natriuretic peptide (BNP) blood test; Complete blood count; Metabolic panel; Thyroid function test; Electrocardiogram (ECG or EKG); Holter monitor; Echocardiogram; Cardiac catheterization and coronary angiogram; Ultrasound of the lungs,"Furosemide (Lasix); Nitroglycerin (Nitromist, Nitrostat, others); Nitroprusside (Nitropress); Inotropes; Morphine (MS Contin, Infumorph, others)"
Pulmonary embolism,Pulmonary embolism,"Diagnosis can be challenging, especially in patients with pre-existing heart or lung conditions.  Diagnosis involves reviewing medical history, physical examination, and utilizing various diagnostic tests to identify the presence of a pulmonary embolism.  High D-dimer levels may suggest increased likelihood, but are not definitive.",Blood thinners (anticoagulants); Clot dissolvers (thrombolytics); Clot removal; Vein filter; Ongoing care with anticoagulants and monitoring,"Blood test (D-dimer, oxygen and carbon dioxide levels, inherited clotting disorder); Chest X-ray; Duplex ultrasonography; CT pulmonary angiography; Ventilation-perfusion (V/Q) scan; Pulmonary angiogram; MRI",Heparin; Warfarin (Jantovin); Newer oral anticoagulants (specific names not provided); Thrombolytics (specific names not provided)
Pulmonary fibrosis,Pulmonary fibrosis,"Diagnosis involves reviewing medical and family history, physical exam (listening to lung sounds for crackling), and various tests to confirm the presence of scar tissue and assess lung function.  If other tests are inconclusive, a lung biopsy may be necessary.",Oxygen therapy; Pulmonary rehabilitation;  Anti-acid medications (for GERD);  Antibiotics; Corticosteroid medicines; Mechanical ventilation; Lung transplant.,"Chest X-ray; Computerized tomography (CT) scan; Echocardiogram; Spirometry; Lung volume test; Lung diffusion test; Pulse oximetry; Six-minute walking test; Exercise stress test; Arterial blood gas test; Biopsy (surgical biopsy, including VATS and thoracotomy; bronchoscopy); Blood tests (liver and kidney function).",Pirfenidone (Esbriet); Nintedanib (Ofev).
Pulmonary hypertension,Pulmonary hypertension,"Diagnosis is challenging due to similar symptoms to other heart and lung conditions; diagnosis involves a physical exam, review of medical and family history, and various tests to confirm the presence of pulmonary hypertension and identify its cause.",Medications; Blood thinners,Blood tests; Chest X-ray; Electrocardiogram (ECG or EKG); Echocardiogram (with optional exercise stress testing); Right heart catheterization; Exercise stress tests; Computerized tomography (CT) scan; Magnetic resonance imaging (MRI); Lung function test; Sleep study; Ventilation/perfusion (V/Q) scan; Lung biopsy; Genetic testing,"epoprostenol (Flolan, Veletri); treprostinil (Remodulin, Tyvaso, others); iloprost; selexipag (Uptravi); riociguat (Adempas); bosentan (Tracleer); macitentan (Opsumit); ambrisentan (Letairis); sildenafil (Revatio, Viagra); tadalafil (Adcirca, Alyq, Cialis); amlodipine (Norvasc); diltiazem (Cardizem, Tiazac, others); nifedipine (Procardia); warfarin (Jantoven); digoxin (Lanoxin); diuretics"
Pulmonary valve disease,Pulmonary valve disease,Diagnosis may be made at birth or later in life.  A heart murmur (whooshing sound) detected with a stethoscope is a potential indicator.  Further testing is required for confirmation.,Regular health checkups; Surgery to repair or replace the valve; Balloon valvuloplasty; Pulmonary valve replacement surgery; Transcatheter pulmonary valve replacement; Valve-in-valve procedure,Electrocardiogram (ECG or EKG); Echocardiogram; Chest X-ray; Cardiac catheterization; Magnetic resonance imaging (MRI); Computerized tomography (CT) scan,Information not found
Pulmonary valve stenosis,Pulmonary valve stenosis,Pulmonary valve stenosis is often diagnosed in childhood but may be detected later. Diagnosis involves listening for a heart murmur using a stethoscope; electrocardiogram (ECG or EKG) to assess heart rhythm and potential heart muscle thickening; echocardiogram to visualize the valve and assess the degree of narrowing; cardiac catheterization with coronary angiogram to measure pressure differences and visualize blood flow; and potentially MRI or CT scans for further imaging.,Balloon valvuloplasty; Pulmonary valve replacement;  Occasional health checkups (for mild cases without symptoms),Electrocardiogram (ECG or EKG); Echocardiogram; Cardiac catheterization; Coronary angiogram; Magnetic resonance imaging (MRI); Computed tomography (CT) scan,Information not found
