Disease_Name_English,Disease_Name_Spanish,Diagnosis,Treatments,Tests,Medications_Drugs
Cyclothymia (cyclothymic disorder),Cyclothymia (cyclothymic disorder),"Diagnosis involves a physical exam and lab tests to rule out medical causes; a psychological evaluation including discussions about thoughts, feelings, and behaviors, possibly with self-assessment questionnaires and input from family/friends; mood charting to track moods, sleep, and other relevant factors; application of DSM-5 criteria:  many periods of elevated mood (hypomanic symptoms) and depressive symptoms for at least two years (one year for children and teenagers), with these highs and lows occurring during at least half that time; periods of stable moods lasting less than two months; symptoms significantly impacting social, work, school, or other important areas; symptoms not meeting criteria for bipolar disorder, major depression, or other mental disorders; symptoms not caused by substance use or medical condition.","Medications; psychotherapy (including CBT and IPSRT); lifestyle modifications (regular exercise, sufficient sleep, avoiding alcohol and drugs); addressing warning signs early;  family/friend involvement in monitoring symptoms.",Physical exam; lab tests; psychological evaluation; mood charting,Information not found
Cystic fibrosis,Cystic fibrosis,"Diagnosis involves newborn screening (IRT blood test); a sweat test (measuring chloride levels in sweat) is performed to confirm positive newborn screens; genetic testing identifies specific gene mutations;  clinical evaluation considers symptoms such as repeated bouts of inflamed pancreas, nasal polyps, chronic sinus infections, lung infections, bronchiectasis, or male infertility.",Preventing and controlling lung infections; Removing and loosening lung mucus; Treating and preventing intestinal blockage; Ensuring adequate nutrition;  managing diabetes or liver disease as needed.,Newborn screening (IRT blood test); Sweat test; Genetic testing,Cystic fibrosis transmembrane conductance regulator (CFTR) modulators; Antibiotics; Anti-inflammatory medicines; Hypertonic saline; Bronchodilators; Pancreatic enzyme capsules; Stool softeners; Acid-reducing medicines.
Cystitis,Cystitis,"Diagnosis is based on symptoms and medical history; urine analysis may be performed to check for bacteria, blood, or pus; urine culture may be done to identify the type of bacteria; imaging (X-ray or ultrasound) may be used to rule out other causes of bladder inflammation.","Antibiotics (for bacterial cystitis); Vaginal estrogen cream (for post-menopausal women with cystitis); Oral medication; Intravesical medication; Nerve stimulation; Surgery (last resort for interstitial cystitis); Avoiding irritating substances (bubble bath, spermicide); Increased fluid intake; Pain management medication (for cystitis due to chemotherapy or radiation).",Urine analysis; Urine culture; X-ray; Ultrasound; Cystoscopy,Antibiotics; Vaginal estrogen cream
Cytomegalovirus (CMV) infection,Cytomegalovirus (CMV) infection,"CMV infection is diagnosed through lab tests detecting the virus in blood, saliva, urine, or tissue samples.  During pregnancy, testing may be recommended based on exposure, symptoms (fever, headache, fatigue, sore throat, swollen glands), ultrasound findings suggesting fetal infection, or a weakened immune system.  Antibody blood tests can detect past infections.  In newborns suspected of congenital CMV, testing occurs within three weeks of birth, followed by tests assessing organ health (liver, kidneys).  Testing is also important for those with weakened immune systems (HIV, AIDS, transplant recipients).",Medications; Speech therapy; Occupational therapy; Assistive devices (hearing aids),Blood tests; Saliva tests; Urine tests; Tissue sample tests; Ultrasound imaging; Amniocentesis,Information not found
Dandruff,Dandruff,Visual examination of the hair and scalp by a doctor.,"Regular cleansing with a gentle shampoo; Medicated dandruff shampoo; Moisturizing conditioner;  Alternating between two types of dandruff shampoos; Prescription-strength shampoo; Steroid lotion; Lifestyle modifications (stress management, healthy diet, scalp care routine, limited sun exposure, limiting hair styling products).",Information not found,"Pyrithione zinc (e.g., DermaZinc, Head & Shoulders); Coal tar (e.g., Neutrogena T/Gel, Scalp 18 Coal Tar Shampoo); Salicylic acid (e.g., Jason Dandruff Relief Treatment Shampoo, Baker P&S); Selenium sulfide (e.g., Head & Shoulders Intensive, Selsun Blue); Ketoconazole (e.g., Nizoral Anti-Dandruff); Fluocinolone (e.g., Capex, Derma-Smoothe/FS); Tea tree oil (although evidence for its effectiveness is lacking)."
De Quervain tenosynovitis,De Quervain tenosynovitis,"Physical examination to assess pain with pressure on the thumb side of the wrist; Finkelstein test (pain with thumb flexion across palm, finger flexion over thumb, and wrist flexion towards little finger).",Immobilization with splint or brace; avoidance of repetitive thumb movements and pinching; ice application; physical therapy; corticosteroid injections; surgery (for serious cases),Finkelstein test; X-rays (generally not needed),ibuprofen; naproxen sodium; corticosteroid injections
Deep vein thrombosis (DVT),Deep vein thrombosis (DVT),"Physical exam checking for leg swelling, tenderness, or skin color changes;  D-dimer blood test to rule out PE; Duplex ultrasound as the standard test to visualize blood flow in veins; Venography (rarely used, invasive X-ray with dye); MRI scan for DVT in abdominal veins.",Blood thinners (anticoagulants); Clot busters (thrombolytics); Vena cava filter placement; Support stockings (compression stockings),D-dimer blood test; Duplex ultrasound; Venography; Magnetic resonance imaging (MRI) scan,Warfarin (Jantoven)
Dehydration,Dehydration,"Diagnosis is often made based on symptoms;  For children, weight change may be used; Blood tests and urinalysis may be used to confirm diagnosis and assess severity.","Fluid replacement; Electrolyte replacement; For infants and children with dehydration from diarrhea, vomiting, or fever: Pedialyte or Smart Water (start with small amounts and increase as tolerated); For older children: watered-down sports drinks (1:1 ratio of sports drink to water); For adults with mild to moderate dehydration: increased water or other liquid intake; For severe dehydration: intravenous fluids and salts.",Blood tests; Urinalysis,Pedialyte; Smart Water; Gatorade; Powerade
Delayed ejaculation,Delayed ejaculation,"Physical exam and medical history; further tests may be needed depending on findings, potentially involving specialists.",Medication adjustment or addition; Psychological counseling; Addressing alcohol or illicit drug use,Blood tests; Urinalysis,Amantadine; Buspirone; Cyproheptadine
Delayed sleep phase,Delayed sleep phase,Review of family and medical history; Physical exam;  May require additional tests to rule out other sleep disorders.,"Improving sleep habits (sleep hygiene: regular sleep schedule, avoiding naps, caffeine, alcohol, and tobacco before bed; exercising at least two hours before bed; avoiding stimulating activities before bed; using bedroom only for sleep and sex); Melatonin supplements; Light therapy; Chronotherapy",Actigraphy; Sleep diary; Sleep study (polysomnography),Melatonin
Delirium,Delirium,"Diagnosis is based on medical history (recent changes like infections, new medications, injuries, pain, substance use); mental status review (testing awareness, attention, thinking, potentially using tests or screenings, and information from family); physical and neurological exams (checking for health problems, disease, vision, balance, coordination, reflexes, to rule out stroke or other diseases); and blood, urine, and other tests; brain imaging tests may be used if other information is insufficient.","Addressing underlying causes (stopping medications, treating infections, correcting imbalances); supportive care (protecting airway, providing fluids/nutrition, assisting movement, pain treatment, managing bladder control, avoiding restraints/tubes, minimizing environmental/caregiver changes, involving family); medications to control pain, agitation, confusion, distrust, fear, or hallucinations (only when symptoms severely impair examination, treatment, or safety, and don't improve with other treatments).",Medical history; Mental status review; Physical exam; Neurological exam; Blood tests; Urine tests; Brain-imaging tests,Information not found
Dementia,demencia,"Diagnosis involves recognizing the pattern of skill and function loss, assessing remaining abilities, reviewing medical history and symptoms, conducting a physical exam, and potentially involving a person close to the patient.  Cognitive and neuropsychological tests evaluate thinking abilities; neurological evaluation assesses movement, balance, senses, and reflexes.  Biomarkers, such as amyloid and tau protein, can aid in Alzheimer's diagnosis.  A psychiatric exam helps rule out other mental health conditions.  No single test definitively diagnoses dementia; multiple tests are typically needed.","Medications; Occupational therapy; Environmental modifications (reducing clutter and noise, using monitoring systems);  Simpler tasks and structured routines;  Exercise; Engaging in enjoyable activities; Establishing a nighttime routine;  Lecanemab-irmb (Leqembi); Donanemab-azbt (Kisunla)",Cognitive and neuropsychological tests; Neurological evaluation; CT scan; MRI; PET scan; Blood tests; Spinal fluid examination,"Donepezil (Aricept, Adlarity); Rivastigmine (Exelon); Galantamine (Zunveyl); Memantine (Namenda); Lecanemab-irmb (Leqembi); Donanemab-azbt (Kisunla)"
Dengue fever,Dengue fever,"Diagnosis is difficult due to overlapping symptoms with other diseases (chikungunya, Zika virus, malaria, typhoid fever).  Diagnosis involves reviewing medical and travel history (including details of international trips and mosquito exposure); a blood test to detect dengue viruses is used for confirmation.",Plenty of fluids; supportive care in a hospital (for severe cases); intravenous (IV) fluid and electrolyte replacement (for severe cases); blood pressure monitoring (for severe cases); blood transfusion (for severe cases),Blood test,Acetaminophen
Depersonalization-derealization disorder,Depersonalization-derealization disorder,"Diagnosis is based on a physical exam to rule out physical health problems, medications, or substance use; lab tests to identify underlying medical issues; and a mental health evaluation assessing symptoms, thoughts, feelings, and behavior patterns to differentiate depersonalization-derealization disorder from other mental health conditions.",Talk therapy (cognitive behavioral therapy and psychodynamic therapy),Physical exam; Lab tests,Information not found
Depression (major depressive disorder),depresión (trastorno depresivo mayor),"Diagnosis is based on a physical exam, questions about health history, potentially lab tests (e.g., complete blood count, thyroid function tests), and a psychiatric evaluation including symptom assessment, thoughts, feelings, and behavior patterns, often using DSM-5 criteria.",Medications; Psychotherapy; Hospital stay (for severe depression); Outpatient treatment program,Complete blood count; Thyroid function tests,"citalopram (Celexa); escitalopram (Lexapro); fluoxetine (Prozac); paroxetine (Paxil, Pexeva); sertraline (Zoloft); vilazodone (Viibryd); duloxetine (Cymbalta); venlafaxine (Effexor XR); desvenlafaxine (Pristiq, Khedezla); levomilnacipran (Fetzima); bupropion (Wellbutrin XL, Wellbutrin SR, Aplenzin, Forfivo XL); mirtazapine (Remeron); nefazodone; trazodone; vortioxetine (Trintellix); imipramine (Tofranil); nortriptyline (Pamelor); amitriptyline; doxepin; trimipramine (Surmontil); desipramine (Norpramin); protriptyline (Vivactil); tranylcypromine (Parnate); phenelzine (Nardil); isocarboxazid (Marplan); selegiline (Emsam); mood stabilizers; antipsychotics; anti-anxiety medications; stimulant medications"
Dermatitis,Dermatitis,Physical examination of the skin; review of symptoms and medical history; skin biopsy to rule out other conditions; patch testing to identify allergens.,"Prescription-strength corticosteroid cream, gel, or ointment; Cream or ointment with a calcineurin inhibitor; Light therapy (phototherapy); Oral corticosteroids; Injectable biologic dupilumab; Wet dressings;  Anti-itch cream (e.g., 1% hydrocortisone cream); Moisturizer; Cool, wet cloth compresses; Oatmeal baths; Medicated shampoos (e.g., selenium sulfide, zinc pyrithione, coal tar, ketoconazole); Bleach baths; Vinegar baths.",Skin biopsy; Patch test,"Corticosteroid cream, gel, or ointment; Calcineurin inhibitor; Oral corticosteroids; Dupilumab; 1% hydrocortisone cream;  Selenium sulfide; Zinc pyrithione; Coal tar; Ketoconazole."
Dermatofibrosarcoma protuberans,Dermatofibrosarcoma protuberans,Diagnosis involves a skin exam to look for signs of skin cancer and a skin biopsy to test for cancer cells; imaging tests like MRI may be used to determine the extent of the cancer.,Surgery to remove the cancer; Mohs surgery; Radiation therapy; Targeted therapy; Clinical trials,Skin exam; Skin biopsy; MRI,Imatinib (Gleevec)
Dermatographia (Dermatographism),Dermatographia (Dermatographism),A raised line or welt appears on the skin within minutes after a tongue depressor is drawn across the arm or back.,Often no treatment is needed; Mild oral antihistamines may be suggested for severe or bothersome symptoms.,Skin stroking test,"fexofenadine (Allegra); loratadine (Alavert, Claritin, others); cetirizine; doxepin"
Dermatomyositis,Dermatomyositis,"Diagnosis of dermatomyositis involves evaluating symptoms and conducting tests to detect muscle damage and autoantibodies.  Elevated muscle enzymes in blood tests, along with characteristic skin findings, suggest the condition.  Further confirmation may involve electromyography, MRI, and skin or muscle biopsies.",Medications; Physical therapy; Speech therapy; Dietetic assessment; Intravenous immunoglobulin (IVIg); Surgery,Blood analysis; Chest X-ray; Electromyography; MRI; Skin biopsy; Muscle biopsy,Prednisone; Azathioprine; Methotrexate; Mycophenolate mofetil; Rituximab; Hydroxychloroquine
Desmoid tumors,Desmoid tumors,Diagnosis involves a physical exam; imaging tests such as CT and MRI scans to visualize the tumor; and a biopsy to definitively identify the tumor cells and assess their aggressiveness.,Monitoring tumor growth; Surgery (complete or partial tumor removal); Radiation therapy; Chemotherapy; Anti-inflammatory drugs; Hormone therapies; Targeted therapies,Physical exam; CT scan; MRI; Biopsy,Information not found
Desmoplastic small round cell tumors,Desmoplastic small round cell tumors,"Diagnosis involves tissue biopsy (obtained surgically or via needle) sent to a lab for testing to identify cancer presence and specific DNA changes;  Imaging tests (ultrasound, CT, MRI, PET) determine cancer size and location; Results help differentiate from similar cancers and inform treatment selection.",Surgery (to remove all or as much cancer as possible); Chemotherapy (whole body or hyperthermic intraperitoneal chemotherapy (HIPEC) for abdominal cancers); Radiation therapy (for abdominal cancers or to manage symptoms in spread cancers); Targeted drug therapy (if cancer recurs or spreads),Biopsy; Ultrasound; CT scan; MRI; PET scan,Information not found
Deviated septum,Deviated septum,"Physical exam involving visual inspection of the nose with a bright light and sometimes a nasal speculum;  Use of a long, thin scope with a light (if needed) to visualize further into the nasal passages.",Surgery (septoplasty);  Medication management of symptoms (decongestants; antihistamines; nasal steroid sprays); Rhinoplasty (sometimes performed concurrently with septoplasty),Physical exam,Decongestants; Antihistamines; Nasal steroid sprays
Diabetes,Diabetes,"Diagnosis of type 1 diabetes involves testing for the presence of autoantibodies and ketones in urine;  an A1C level of 6.5% or higher on two separate tests; a random blood sugar level of 200 mg/dL (11.1 mmol/L) or higher; a fasting blood sugar level of 126 mg/dL (7 mmol/L) or higher on two separate tests; or a glucose tolerance test result of more than 200 mg/dL (11.1 mmol/L) after two hours.  Symptoms often start suddenly.  For type 2 diabetes and prediabetes, screening guidelines consider BMI, age, risk factors (high blood pressure, abnormal cholesterol, inactivity, PCOS, family history, heart disease), and gestational diabetes history.","Automated insulin delivery system (continuous glucose monitor, insulin pump, computer algorithm); Pancreas transplantation; Islet transplantation; Immune suppressive medication (research setting); Healthy diet; Maintaining a healthy weight; Regular physical activity; Blood sugar monitoring; Insulin; Oral drugs (for type 2 diabetes)",A1C test; Random blood sugar test; Fasting blood sugar test; Glucose tolerance test; Urine test for ketones; Autoantibody test,Insulin; Immune suppressive medication (unspecified)
Diabetes insipidus,Diabetes insipidus,"Diagnosis involves assessing symptoms (excessive thirst and urination), evaluating urine concentration, and identifying the type of diabetes insipidus (central, nephrogenic, gestational, or primary polydipsia) through tests that measure ADH levels and kidney response to ADH.  A water deprivation test, measuring changes in body weight, urine output, and urine/blood concentration, is key; blood tests check sodium, potassium, and calcium levels.  Imaging (MRI) may identify pituitary or hypothalamic issues; genetic testing may be considered in families with a history of the condition.","Increased water intake; Treatment of underlying disorders (e.g., pituitary tumors); Desmopressin (DDAVP, Nocdurna) for central and gestational DI; Low-salt diet for nephrogenic DI; Hydrochlorothiazide (Microzide) for nephrogenic DI; Discontinuing causative medications (if applicable); Reducing fluid intake for primary polydipsia; Treatment of any associated mental illness.","Water deprivation test; Urine test; Blood tests (sodium, potassium, calcium levels); Magnetic resonance imaging (MRI); Genetic testing","Desmopressin (DDAVP, Nocdurna); Hydrochlorothiazide (Microzide)"
Diabetic coma,Diabetic coma,"Physical exam; review of medical history; blood tests to measure blood sugar level, ketone level, and levels of nitrogen, creatinine, potassium, and sodium in the blood.  A medical identification bracelet or necklace is helpful if the patient has diabetes.","Intravenous fluids; Potassium, sodium, or phosphate supplements; Insulin; Glucagon injection; Intravenous dextrose.","Blood sugar level test; Ketone level test; Blood urea nitrogen (BUN) test; Creatinine test; Blood test for potassium, sodium, and nitrogen levels.",Insulin; Glucagon
Diabetic hypoglycemia,Diabetic hypoglycemia,"Symptoms of low blood sugar are checked with a blood glucose meter; hypoglycemia is often defined as blood sugar below 70 mg/dL or 3.9 mmol/L, but the specific range may vary by individual.","Eat or drink carbohydrates (glucose tablets, glucose gel, hard candy, jelly beans, fruit juice, regular soda, sugar, corn syrup, honey); Recheck blood sugar after 15 minutes and repeat treatment if necessary; Have a snack or meal to prevent further drops;  Glucagon injection (emergency treatment for severe hypoglycemia); Continuous glucose monitor (for frequent or severe hypoglycemia); Insulin dose adjustment as needed",Blood glucose meter,Glucagon
Diabetic ketoacidosis,Diabetic ketoacidosis,"Physical exam and blood tests (measuring blood sugar level, ketone level, and blood acidity);  Additional tests may be needed to identify the underlying cause and check for complications.",Fluids (oral or IV); Electrolyte replacement (IV); Insulin therapy (IV),Blood tests; Urinalysis; Chest X-ray; Electrocardiogram (ECG or EKG),Insulin
Diabetic nephropathy (kidney disease),Diabetic nephropathy (kidney disease),"Diabetic nephropathy is usually diagnosed during routine diabetes management testing.  Key tests include urinary albumin test, albumin/creatinine ratio, and glomerular filtration rate (GFR).  A kidney biopsy may be used for confirmation.  Yearly testing is recommended for type 2 diabetics and type 1 diabetics after 5 years.","Control of diabetes and high blood pressure through diet, lifestyle changes, exercise, and medication;  Kidney transplant; Kidney dialysis (hemodialysis and peritoneal dialysis); Symptom management for end-stage kidney disease;  Weight-loss surgery (if needed)",Urinary albumin test; Albumin/creatinine ratio; Glomerular filtration rate (GFR); X-rays; Ultrasound; CT scan; MRI scan; Kidney biopsy,ACE inhibitors; Angiotensin 2 receptor blockers (ARBs); Insulin; Metformin; Glucagon-like peptide 1 (GLP-1) receptor agonists; SGLT2 inhibitors; Statins; Finerenone (Kerendia); Aspirin
Diabetic neuropathy,Diabetic neuropathy,"Physical exam assessing muscle strength, tone, reflexes, and sensitivity to touch, pain, temperature, and vibration;  Filament testing; Sensory testing; Nerve conduction testing; Electromyography; Autonomic testing.",Maintain blood sugar within target range; Control blood pressure; Maintain healthy weight; Regular physical activity;  Prescription medications for pain relief.,Filament testing; Sensory testing; Nerve conduction testing; Electromyography; Autonomic testing,"Pregabalin (Lyrica); Gabapentin (Gralise, Neurontin); Amitriptyline; Nortriptyline (Pamelor); Desipramine (Norpramin); Duloxetine (Cymbalta); Venlafaxine (Effexor XR); Acetaminophen (Tylenol, others)"
Diabetic retinopathy,Diabetic retinopathy,Comprehensive dilated eye exam to visualize abnormalities inside and outside the eye.,Close monitoring for mild/moderate nonproliferative diabetic retinopathy; Injection of vascular endothelial growth factor (VEGF) inhibitors into the vitreous; Photocoagulation (focal or panretinal); Vitrectomy,Dilated eye exam; Fluorescein angiography; Optical coherence tomography (OCT),faricimab-svoa (Vabysmo); ranibizumab (Lucentis); aflibercept (Eylea); bevacizumab (Avastin)
Diaper rash,Diaper rash,"Diagnosis of diaper rash is primarily based on clinical examination of the affected area;  Visual inspection for redness, inflammation, and possible secondary infections (fungal or bacterial) are key diagnostic criteria. If home treatment fails to resolve the rash, a doctor's consultation is recommended to rule out complications or alternative diagnoses.","Keeping the diaper area clean and dry; Applying a barrier cream, paste, or ointment (zinc oxide or petroleum jelly); Using a mild hydrocortisone cream (0.5% to 1%) for a limited duration; Applying antifungal cream for fungal infections; Oral antibiotic medication for bacterial infections; Increasing airflow to the diaper area; Daily bathing with mild, fragrance-free soap; Avoiding irritating products;  Consultation with a dermatologist if the rash persists.",Information not found,"0.5% to 1% hydrocortisone cream; Antifungal cream (e.g., Lotrimin); Oral antibiotics;  Products containing zinc oxide or petroleum jelly (e.g., A + D, Balmex, Desitin, Triple Paste)"
Diarrhea,Diarrhea,Medical history review; Medication review; Physical exam; Evaluation of symptom severity and duration.  Further testing may be done depending on the findings of these initial steps.,"Lifestyle changes (increased fluid intake, dietary adjustments); Fluid and electrolyte replacement (oral or IV); Antibiotics; Antiparasitics; Treatment of underlying conditions; Antidiarrheal medications (loperamide, bismuth subsalicylate); Probiotics","Blood tests (complete blood count, electrolyte levels, kidney function); Stool test; Hydrogen breath test; Flexible sigmoidoscopy; Colonoscopy; Upper endoscopy; Biopsy",Loperamide; Bismuth subsalicylate; Antibiotics; Antiparasitics
Diffuse large B-cell lymphoma,Diffuse large B-cell lymphoma,"Diagnosis begins with a physical exam checking for swollen lymph nodes and enlarged spleen/liver;  followed by blood tests, imaging tests, and a tissue biopsy (lymph node or other tissue depending on symptoms and imaging).  Lab testing of biopsy samples and bone marrow (if indicated) identifies the presence and characteristics of lymphoma cells, including specific protein markers (CD20, CD19, CD22, CD79a, CD10) and DNA changes (translocations involving BCL2, BCL6, and MYC). Bone marrow aspiration and biopsy may be done if imaging suggests bone involvement or to determine the extent of cancer.  Lumbar puncture may be performed if neurological symptoms are present or there's a higher risk of central nervous system lymphoma.",Immunotherapy; Chemotherapy; Radiation therapy; Targeted therapy; CAR-T cell therapy; Bone marrow transplant,Physical exam; Blood tests (including LDH levels and viral markers); MRI; CT scan; PET scan; Lymph node biopsy; Biopsy of other tissue; Bone marrow aspiration; Bone marrow biopsy; Lumbar puncture,Information not found
Diffuse midline glioma (DMG),Diffuse midline glioma (DMG),"Diagnosis is typically made through a review of symptoms, physical exam, medical history, and primarily through MRI to identify the tumor's location and features (poorly defined borders).  A biopsy may be performed if MRI is inconclusive, testing for the H3K27-altered gene mutation.","Radiation therapy; Surgery (usually not an option due to tumor location and poorly defined borders); Chemotherapy (usually ineffective, sometimes used with radiation); Palliative treatment (including steroid medicines, support for feeding and nutrition, speech therapy, occupational therapy, physical therapy, anti-seizure medication, pain medicine, procedures to drain fluid buildup on the brain, and counseling)",MRI; Biopsy,Steroid medicines; Anti-seizure medication; Pain medicine
